{
  "version": "1.0.0",
  "family": "trust",
  "verb": "approve",
  "receipt_id": "rcpt-approve-20260510-0001",
  "request": {
    "version": "1.0.0",
    "family": "trust",
    "verb": "approve",
    "approver": "runtime.commandlayer.eth",
    "subject": {
      "type": "deployment_request",
      "id": "deploy-orders-api-2026-05-10-rc3",
      "uri": "cl://deploy/requests/deploy-orders-api-2026-05-10-rc3",
      "content_hash": "sha256:aaaaaaaaaaaaaaaaaaaaaaaaaaaaaaaaaaaaaaaaaaaaaaaaaaaaaaaaaaaaaaaa"
    },
    "approval_scope": "production-deployment",
    "conditions": {
      "change_window": "2026-05-10T13:00:00Z/2026-05-10T14:00:00Z",
      "requires_post_check": "synthetic-http-5m"
    },
    "context": {
      "environment": "prod-us-east-1",
      "policy_id": "policy.prod.change-approval.v5",
      "tenant_id": "tenant-acme-prod",
      "request_id": "req-approve-20260510-0001",
      "correlation_id": "corr-release-20260510-a8"
    }
  },
  "approval": {
    "status": "approved",
    "approval_id": "approval-prod-deploy-20260510-01",
    "reason": "All deployment gates passed and change window active.",
    "expires_at": "2026-05-10T14:00:00Z"
  },
  "ts": "2026-05-10T12:05:00Z",
  "metadata": {
    "proof": {
      "canonicalization": "json.sorted_keys.v1",
      "hash": {
        "alg": "SHA-256",
        "value": "aaaaaaaaaaaaaaaaaaaaaaaaaaaaaaaaaaaaaaaaaaaaaaaaaaaaaaaaaaaaaaaa"
      },
      "signature": {
        "alg": "Ed25519",
        "value": "ed25519:demo:9f7c4d1ab3e6c8d14f2a98b7c3d5e1f09a8b7c6d5e4f3029182736455aabbccd",
        "kid": "cl-key-1"
      }
    }
  }
}
